{
  "schemaVersion": 1,
  "jobId": "batch-3835cf4f7db191",
  "pipelineVersion": "recipe-pipeline-1",
  "productionContract": null,
  "referenceDataVersion": "1.0.0",
  "referenceDataDigest": "56f3949bd1c0348f8fe65861ebcda23c2a198805cd2e9f70b00610a328753b52",
  "seed": "phase4-smoke-seed:3835cf4f7db191ee",
  "targetCatalogVersion": "0.4.0-dev",
  "sourceLocale": "it",
  "requiredLocales": [
    "it",
    "en"
  ],
  "targetAcceptedCount": 5,
  "candidateCount": 7,
  "mealArchetypes": [
    "dinner"
  ],
  "energyKcal": {
    "min": 300,
    "max": 799
  },
  "proteinG": null,
  "fiberG": null,
  "maxTotalMinutes": null,
  "recipeFamilies": [],
  "cuisineFocus": [],
  "practicalityTargets": [
    "practical_portable"
  ],
  "requiredTags": [],
  "forbiddenTags": [],
  "preferredUnderusedIngredientIds": [
    "ing_salmon",
    "ing_rice_cooked",
    "ing_zucchini"
  ],
  "diversityTargets": {
    "minDistinctPrimaryIngredients": 3,
    "minDistinctIngredientIds": 4,
    "maxPrimaryIngredientFrequency": 2,
    "maxIngredientPairFrequency": 2
  },
  "coverageTargets": [
    {
      "targetId": "smoke-dinner",
      "key": "dinner",
      "dimension": "meal_archetype",
      "criteria": [
        {
          "dimension": "meal_archetype",
          "key": "dinner"
        }
      ],
      "desiredAcceptedGain": 3
    },
    {
      "targetId": "smoke-portable",
      "key": "practical_portable",
      "dimension": "practicality",
      "criteria": [
        {
          "dimension": "practicality",
          "key": "practical_portable"
        }
      ],
      "desiredAcceptedGain": 3
    }
  ],
  "allowedIngredientIds": [
    "ing_olive_oil",
    "ing_rice_cooked",
    "ing_salmon",
    "ing_zucchini"
  ],
  "orchestration": {
    "runId": "orun-build-cae6a8980f7f",
    "inputSnapshotId": "snapshot-0.3.0-dev-82a94580d4f8",
    "policyId": "corpus-policy-phase4-smoke",
    "policyVersion": "1.0.0",
    "plannedPriority": 1.105567,
    "targetIds": [
      "smoke-dinner",
      "smoke-portable"
    ],
    "reasons": [
      "meal_archetype:dinner deficit=0.625",
      "practicality:practical_portable deficit=0.667"
    ]
  }
}
